{
  "schema_name": "fixture_manifest",
  "schema_version": "1.0",
  "fixture_id": "l_bracket_synthetic_001",
  "class": "SYNTHETIC",
  "source": {
    "type": "MANUAL_BREP_AND_ANALYTICAL",
    "construction_method": "independent_occ_primitives"
  },
  "input_files": [
    {
      "role": "PART_3D",
      "path": "fixtures/synthetic/l_bracket.brep",
      "content_hash": "sha256:e9b066665f0ef13987c2183caf53e2bd7c08e42d981ec439e90002042947349c",
      "units": "mm",
      "artifact_provenance": "DIRECT_EXPORT"
    },
    {
      "role": "EXPECTED_JSON",
      "path": "fixtures/synthetic/l_bracket.expected.json",
      "content_hash": "sha256:2248ab587541742fa5138c120aa0cd514477640128e6c9559759e5d0f4256bb4",
      "units": "mm",
      "artifact_provenance": "DIRECT_EXPORT"
    }
  ],
  "ground_truth": {
    "bends_count": 1,
    "bend_sequence": [
      {
        "bend_id": "BEND_01",
        "angle_deg": 90.0,
        "direction": "UP",
        "radius_internal_mm": 1.0,
        "requires_gooseneck": false,
        "source": "GEOMETRIC_INFERENCE"
      }
    ],
    "bend_sequence_operator_confirmed": false,
    "expected_status": "POSITIVE",
    "production_eligible": true,
    "thickness_mm": 1.5,
    "radius_internal_mm": 1.0,
    "k_factor": null,
    "requires_gooseneck": false,
    "negative_reason": null,
    "source_of_truth": "GEOMETRIC_INFERENCE"
  },
  "tolerance_profile": {
    "linear_tol_mm": 0.001,
    "angular_tol_deg": 0.001,
    "volume_tol_mm3": 0.001,
    "bbox_tol_mm": 0.001,
    "surface_distance_tol_mm": 0.01
  },
  "known_limitations": [
    "k_factor не используется при построении — фикстура чисто геометрическая",
    "Springback не учтён",
    "expected values verified analytically; ground truth source is geometric construction"
  ]
}
